{
  "schema_version": 1,
  "paper_id": "arxiv:0910.2773v2",
  "arxiv_id": "0910.2773",
  "version": 2,
  "title": "Dissecting the Gravitational Lens B1608+656. II. Precision Measurements of the Hubble Constant, Spatial Curvature, and the Dark Energy Equation of State",
  "authors": [
    "S. H. Suyu",
    "P. J. Marshall",
    "M. W. Auger",
    "S. Hilbert",
    "R. D. Blandford",
    "L. V. E. Koopmans",
    "C. D. Fassnacht",
    "T. Treu"
  ],
  "categories": [
    "astro-ph.CO"
  ],
  "published_utc": "2009-10-15T17:43:59Z",
  "updated_utc": "2010-01-28T17:03:57Z",
  "urls": {
    "abstract": "https://arxiv.org/abs/0910.2773v2",
    "html": "https://arxiv.org/html/0910.2773v2",
    "pdf": "https://arxiv.org/pdf/0910.2773v2"
  },
  "license": {
    "status": "Unreported in retrieved Atom metadata",
    "redistribution": "links_and_original_notes_only",
    "reason": "Public accessibility does not establish redistribution rights. Sources, copied abstracts and worker packets stay ignored."
  },
  "artifacts": [
    {
      "url": "https://export.arxiv.org/api/query?id_list=astro-ph%2F9506072%2Castro-ph%2F9909275%2Castro-ph%2F9603033%2Castro-ph%2F9709112%2C1104.2933%2Castro-ph%2F9911177%2C1907.12875%2C2112.01471%2C2110.03487%2C1606.00439%2C0910.2773%2Castro-ph%2F0701828%2C1801.08023&max_results=13",
      "retrieved_utc": "2026-10-02T21:49:20.413721+00:00",
      "sha256": "6e164a90b318339054952d52ef87039f99e27702268159e0d972efa7e2c6c4cd",
      "bytes": 46475,
      "role": "metadata"
    },
    {
      "role": "pdf",
      "url": "https://arxiv.org/pdf/0910.2773v2",
      "retrieved_utc": "2026-10-02T21:49:52.244657+00:00",
      "sha256": "49713641ce2c8c82994f6365b112dc349b1388b048819f712ab565a4043feeff",
      "bytes": 701443
    },
    {
      "role": "extracted_text",
      "url": "https://arxiv.org/pdf/0910.2773v2",
      "retrieved_utc": "2026-10-02T21:49:52.826128+00:00",
      "sha256": "b66de6042d23830b383f5a1f87625b073295b487bed81815277f7011b1e63c53",
      "bytes": 189992,
      "tool": "pdftotext -layout",
      "derived_from_sha256": "49713641ce2c8c82994f6365b112dc349b1388b048819f712ab565a4043feeff"
    }
  ],
  "screen": {
    "status": "selected",
    "basis": "metadata",
    "reason": "Known primary identity admitted for explicitly scoped standard-model source audit. Located Sol checks are separate; complete Luna reading remains pending."
  },
  "extraction": null,
  "review_id": null,
  "idea_ids": []
}
