{
  "schema_version": 1,
  "paper_id": "arxiv:2503.14738v3",
  "arxiv_id": "2503.14738",
  "version": 3,
  "title": "DESI DR2 Results II: Measurements of Baryon Acoustic Oscillations and Cosmological Constraints",
  "authors": [
    "DESI Collaboration",
    "M. Abdul-Karim",
    "J. Aguilar",
    "S. Ahlen",
    "S. Alam",
    "L. Allen",
    "C. Allende Prieto",
    "O. Alves",
    "A. Anand",
    "U. Andrade",
    "E. Armengaud",
    "A. Aviles",
    "S. Bailey",
    "C. Baltay",
    "P. Bansal",
    "A. Bault",
    "J. Behera",
    "S. BenZvi",
    "D. Bianchi",
    "C. Blake",
    "S. Brieden",
    "A. Brodzeller",
    "D. Brooks",
    "E. Buckley-Geer",
    "E. Burtin",
    "R. Calderon",
    "R. Canning",
    "A. Carnero Rosell",
    "P. Carrilho",
    "L. Casas",
    "F. J. Castander",
    "R. Cereskaite",
    "M. Charles",
    "E. Chaussidon",
    "J. Chaves-Montero",
    "D. Chebat",
    "X. Chen",
    "T. Claybaugh",
    "S. Cole",
    "A. P. Cooper",
    "A. Cuceu",
    "K. S. Dawson",
    "A. de la Macorra",
    "A. de Mattia",
    "N. Deiosso",
    "J. Della Costa",
    "R. Demina",
    "A. Dey",
    "B. Dey",
    "Z. Ding",
    "P. Doel",
    "J. Edelstein",
    "D. J. Eisenstein",
    "W. Elbers",
    "P. Fagrelius",
    "K. Fanning",
    "E. Fernández-García",
    "S. Ferraro",
    "A. Font-Ribera",
    "J. E. Forero-Romero",
    "C. S. Frenk",
    "C. Garcia-Quintero",
    "L. H. Garrison",
    "E. Gaztañaga",
    "H. Gil-Marín",
    "S. Gontcho A Gontcho",
    "D. Gonzalez",
    "A. X. Gonzalez-Morales",
    "C. Gordon",
    "D. Green",
    "G. Gutierrez",
    "J. Guy",
    "B. Hadzhiyska",
    "C. Hahn",
    "S. He",
    "M. Herbold",
    "H. K. Herrera-Alcantar",
    "M. Ho",
    "K. Honscheid",
    "C. Howlett",
    "D. Huterer",
    "M. Ishak",
    "S. Juneau",
    "N. V. Kamble",
    "N. G. Karaçaylı",
    "R. Kehoe",
    "S. Kent",
    "A. G. Kim",
    "D. Kirkby",
    "T. Kisner",
    "S. E. Koposov",
    "A. Kremin",
    "A. Krolewski",
    "O. Lahav",
    "C. Lamman",
    "M. Landriau",
    "D. Lang",
    "J. Lasker",
    "J. M. Le Goff",
    "L. Le Guillou",
    "A. Leauthaud",
    "M. E. Levi",
    "Q. Li",
    "T. S. Li",
    "K. Lodha",
    "M. Lokken",
    "F. Lozano-Rodríguez",
    "C. Magneville",
    "M. Manera",
    "P. Martini",
    "W. L. Matthewson",
    "A. Meisner",
    "J. Mena-Fernández",
    "A. Menegas",
    "T. Mergulhão",
    "R. Miquel",
    "J. Moustakas",
    "A. Muñoz-Gutiérrez",
    "D. Muñoz-Santos",
    "A. D. Myers",
    "S. Nadathur",
    "K. Naidoo",
    "L. Napolitano",
    "J. A. Newman",
    "G. Niz",
    "H. E. Noriega",
    "E. Paillas",
    "N. Palanque-Delabrouille",
    "J. Pan",
    "J. Peacock",
    "Marcos Pellejero Ibanez",
    "W. J. Percival",
    "A. Pérez-Fernández",
    "I. Pérez-Ràfols",
    "M. M. Pieri",
    "C. Poppett",
    "F. Prada",
    "D. Rabinowitz",
    "A. Raichoor",
    "C. Ramírez-Pérez",
    "M. Rashkovetskyi",
    "C. Ravoux",
    "J. Rich",
    "A. Rocher",
    "C. Rockosi",
    "J. Rohlf",
    "J. O. Román-Herrera",
    "A. J. Ross",
    "G. Rossi",
    "R. Ruggeri",
    "V. Ruhlmann-Kleider",
    "L. Samushia",
    "E. Sanchez",
    "N. Sanders",
    "D. Schlegel",
    "M. Schubnell",
    "H. Seo",
    "A. Shafieloo",
    "R. Sharples",
    "J. Silber",
    "F. Sinigaglia",
    "D. Sprayberry",
    "T. Tan",
    "G. Tarlé",
    "P. Taylor",
    "W. Turner",
    "L. A. Ureña-López",
    "R. Vaisakh",
    "F. Valdes",
    "G. Valogiannis",
    "M. Vargas-Magaña",
    "L. Verde",
    "M. Walther",
    "B. A. Weaver",
    "D. H. Weinberg",
    "M. White",
    "M. Wolfson",
    "C. Yèche",
    "J. Yu",
    "E. A. Zaborowski",
    "P. Zarrouk",
    "Z. Zhai",
    "H. Zhang",
    "C. Zhao",
    "G. B. Zhao",
    "R. Zhou",
    "H. Zou"
  ],
  "categories": [
    "astro-ph.CO"
  ],
  "published_utc": "2025-03-18T21:14:12Z",
  "updated_utc": "2025-10-09T16:45:28Z",
  "urls": {
    "abstract": "https://arxiv.org/abs/2503.14738v3",
    "html": "https://arxiv.org/html/2503.14738v3",
    "pdf": "https://arxiv.org/pdf/2503.14738v3"
  },
  "license": {
    "status": "unreported in retrieved Atom metadata",
    "redistribution": "links_and_original_notes_only",
    "reason": "Only links, metadata and short original notes published; raw sources stay ignored. Public accessibility alone is not redistribution permission."
  },
  "artifacts": [
    {
      "role": "metadata",
      "url": "https://export.arxiv.org/api/query?id_list=1807.06209%2C2503.14738%2C2202.04077%2C2112.03863%2C2112.03864%2C2112.04510&max_results=6",
      "retrieved_utc": "2026-10-01T15:05:28.214522+00:00",
      "sha256": "7a7e87dad3d215a26af3e471add7c44d2b6d2589e02dc32b535334898d8563e0",
      "bytes": 45217
    },
    {
      "bytes": 1170284,
      "role": "html",
      "url": "https://arxiv.org/html/2503.14738v3",
      "retrieved_utc": "2026-10-01T15:05:44.554248+00:00",
      "sha256": "782d7b25d5a6d7195e0dc0cfdab029e49a4b05cff8263e18f843e82e9c054c49"
    }
  ],
  "screen": {
    "status": "selected",
    "basis": "full_text",
    "reason": "Explicitly requested baseline reference source; targeted original-source checks only. No Luna extraction, full-paper reading or full-paper review claimed."
  },
  "extraction": null,
  "review_id": null,
  "idea_ids": []
}
