{
  "schema_version": 1,
  "paper_id": "arxiv:1107.5596v2",
  "arxiv_id": "1107.5596",
  "version": 2,
  "title": "Gamma ray burst distances and the timescape cosmology",
  "authors": [
    "Peter R. Smale"
  ],
  "categories": [
    "astro-ph.CO",
    "gr-qc"
  ],
  "published_utc": "2011-07-27T21:22:48Z",
  "updated_utc": "2011-08-22T21:48:58Z",
  "urls": {
    "abstract": "https://arxiv.org/abs/1107.5596v2",
    "html": "https://arxiv.org/html/1107.5596v2",
    "pdf": "https://arxiv.org/pdf/1107.5596v2"
  },
  "license": {
    "status": "unknown",
    "redistribution": "links_and_original_notes_only",
    "reason": "Per-paper redistribution terms not checked; public record contains links, descriptive metadata and original notes."
  },
  "artifacts": [
    {
      "role": "metadata",
      "url": "https://export.arxiv.org/api/query?search_query=ti%3Atimescape&start=0&max_results=5&sortBy=lastUpdatedDate&sortOrder=descending",
      "retrieved_utc": "2026-10-01T00:44:41.451093+00:00",
      "sha256": "7bcba14d2218e1d0ca8eae4772e8faeaf45d38667a7ec837539a7faeda26e3bb",
      "bytes": 10909
    }
  ],
  "screen": {
    "status": "deferred",
    "basis": "abstract",
    "reason": "Retain weak GRB discriminator: abstract reports systematics insufficient to distinguish the compared models."
  },
  "extraction": null,
  "review_id": null,
  "idea_ids": []
}
