{
  "schema_version": 1,
  "paper_id": "arxiv:astro-ph/9801212v1",
  "arxiv_id": "astro-ph/9801212",
  "version": 1,
  "title": "Circles in the Sky: Finding Topology with the Microwave Background Radiation",
  "authors": [
    "Neil Cornish",
    "David Spergel",
    "Glenn Starkman"
  ],
  "categories": [
    "astro-ph",
    "gr-qc",
    "hep-th"
  ],
  "published_utc": "1998-01-22T16:50:54Z",
  "updated_utc": "1998-01-22T16:50:54Z",
  "urls": {
    "abstract": "https://arxiv.org/abs/astro-ph/9801212v1",
    "html": "https://arxiv.org/html/astro-ph/9801212v1",
    "pdf": "https://arxiv.org/pdf/astro-ph/9801212v1"
  },
  "license": {
    "status": "Assumed arXiv.org perpetual non-exclusive license",
    "redistribution": "links_and_original_notes_only",
    "reason": "Licence notice inspected in pinned HTML with source hash 08ad8b5b8576dff4600ceb502007e520cb28bbd92efb813b8267f99f440b9fc4. Short original notes and links only in public records; owner-authorized private custody, no explicit private-copy prohibition observed."
  },
  "artifacts": [
    {
      "role": "metadata",
      "url": "https://export.arxiv.org/api/query?id_list=astro-ph%2F9801212%2C1403.2190v2%2C2210.11426v4%2C1502.01593%2C2306.17112v3%2C2403.09221v2%2C2608.25033v1&max_results=7",
      "retrieved_utc": "2026-10-09T17:51:41.460556+00:00",
      "sha256": "1a818ed7ee3cb63a165ebf3a573fdd6595806ec192958cb1c5b7594b29d21c54",
      "bytes": 36053
    },
    {
      "role": "html",
      "url": "https://arxiv.org/html/astro-ph/9801212v1",
      "retrieved_utc": "2026-10-09T17:51:44.797344+00:00",
      "sha256": "08ad8b5b8576dff4600ceb502007e520cb28bbd92efb813b8267f99f440b9fc4",
      "bytes": 152994
    },
    {
      "role": "pdf",
      "url": "https://arxiv.org/pdf/astro-ph/9801212v1",
      "retrieved_utc": "2026-10-09T17:51:48.482918+00:00",
      "sha256": "060d9a2d7be7579221d0cbd50de2bfdfd47868ab5ef339adfae7c0a28de9b93f",
      "bytes": 495581
    },
    {
      "role": "extracted_text",
      "url": "https://arxiv.org/pdf/astro-ph/9801212v1",
      "retrieved_utc": "2026-10-09T17:51:49.109676+00:00",
      "sha256": "21fe126ec234854db961984e11ff653bb0bd498fcfc68272f5be7f38d2039b43",
      "bytes": 40785,
      "derived_from_sha256": "060d9a2d7be7579221d0cbd50de2bfdfd47868ab5ef339adfae7c0a28de9b93f",
      "tool": "pdftotext -layout"
    }
  ],
  "screen": {
    "status": "deferred",
    "basis": "abstract",
    "reason": "Foundation, null-result challenge, independent statistical method, or later information forecast retained as bounded frontier; no full reading or reviewed physics yet."
  },
  "extraction": null,
  "review_id": null,
  "idea_ids": []
}
