{
  "schema_version": 1,
  "paper_id": "arxiv:astro-ph/9911177v2",
  "arxiv_id": "astro-ph/9911177",
  "version": 2,
  "title": "Efficient Computation of CMB anisotropies in closed FRW models",
  "authors": [
    "Antony Lewis",
    "Anthony Challinor",
    "Anthony Lasenby"
  ],
  "categories": [
    "astro-ph"
  ],
  "published_utc": "1999-11-10T17:57:36Z",
  "updated_utc": "2000-06-01T12:13:06Z",
  "urls": {
    "abstract": "https://arxiv.org/abs/astro-ph/9911177v2",
    "html": "https://arxiv.org/html/astro-ph/9911177v2",
    "pdf": "https://arxiv.org/pdf/astro-ph/9911177v2"
  },
  "license": {
    "status": "Unreported in retrieved Atom metadata",
    "redistribution": "links_and_original_notes_only",
    "reason": "Public accessibility does not establish redistribution rights. Sources, copied abstracts and worker packets stay ignored."
  },
  "artifacts": [
    {
      "url": "https://export.arxiv.org/api/query?id_list=astro-ph%2F9506072%2Castro-ph%2F9909275%2Castro-ph%2F9603033%2Castro-ph%2F9709112%2C1104.2933%2Castro-ph%2F9911177%2C1907.12875%2C2112.01471%2C2110.03487%2C1606.00439%2C0910.2773%2Castro-ph%2F0701828%2C1801.08023&max_results=13",
      "retrieved_utc": "2026-10-02T21:49:20.413721+00:00",
      "sha256": "6e164a90b318339054952d52ef87039f99e27702268159e0d972efa7e2c6c4cd",
      "bytes": 46475,
      "role": "metadata"
    },
    {
      "role": "html",
      "url": "https://arxiv.org/html/astro-ph/9911177v2",
      "retrieved_utc": "2026-10-02T21:50:34.804897+00:00",
      "sha256": "285808e85fcb62a9fea5650b49ef16f15a7e1bb4d7ec877d5a7197058fcae57b",
      "bytes": 109662
    },
    {
      "role": "pdf",
      "url": "https://arxiv.org/pdf/astro-ph/9911177v2",
      "retrieved_utc": "2026-10-02T21:50:38.032447+00:00",
      "sha256": "16422d65ab246a0a1a783e917c0946e1931fbe8e49651430c6676f428ca03df0",
      "bytes": 223249
    },
    {
      "role": "extracted_text",
      "url": "https://arxiv.org/pdf/astro-ph/9911177v2",
      "retrieved_utc": "2026-10-02T21:50:38.225550+00:00",
      "sha256": "463991841228a468a5832ec848fd2ee4abfff27fa7448dab538ad7de5d3af9fb",
      "bytes": 29233,
      "tool": "pdftotext -layout",
      "derived_from_sha256": "16422d65ab246a0a1a783e917c0946e1931fbe8e49651430c6676f428ca03df0"
    }
  ],
  "screen": {
    "status": "selected",
    "basis": "metadata",
    "reason": "Known primary identity admitted for explicitly scoped standard-model source audit. Located Sol checks are separate; complete Luna reading remains pending."
  },
  "extraction": null,
  "review_id": null,
  "idea_ids": []
}
