{
  "schema_version": 1,
  "paper_id": "arxiv:2609.25412v1",
  "arxiv_id": "2609.25412",
  "version": 1,
  "title": "CHASE Spectral Survey I: Measuring Contamination in the Color-selected J-region Asymptotic Giant Branch Distance Indicator",
  "authors": [
    "Siyang Li",
    "Alexei V. Filippenko",
    "Arief Ahmad",
    "Adam G. Riess",
    "Stefano Casertano",
    "Thomas G. Brink",
    "Richard Anderson",
    "Caroline D. Huang",
    "Louise Breuval",
    "Noriyuki Matsunaga",
    "Gracelynn Jost",
    "Yash Mehta",
    "Elaina Sadler",
    "Julian Shapiro"
  ],
  "categories": [
    "astro-ph.GA",
    "astro-ph.CO"
  ],
  "published_utc": "2026-09-21T21:10:24Z",
  "updated_utc": "2026-09-21T21:10:24Z",
  "urls": {
    "abstract": "https://arxiv.org/abs/2609.25412v1",
    "html": "https://arxiv.org/html/2609.25412v1",
    "pdf": "https://arxiv.org/pdf/2609.25412v1"
  },
  "license": {
    "status": "unknown",
    "redistribution": "links_and_original_notes_only",
    "reason": "Per-paper redistribution terms not checked; public record contains links, descriptive metadata and original notes."
  },
  "artifacts": [
    {
      "role": "metadata",
      "url": "https://export.arxiv.org/api/query?search_query=%28cat%3Aastro-ph.CO+OR+cat%3Agr-qc+OR+cat%3Ahep-th%29+AND+%28all%3A%22Hubble+tension%22+OR+all%3Atimescape+OR+ti%3Adeceleration%29&start=0&max_results=10&sortBy=lastUpdatedDate&sortOrder=descending",
      "retrieved_utc": "2026-10-01T00:43:47.157910+00:00",
      "sha256": "ae4d5b5beda6d1d785bbb5104a1f000f59d404fa96e6feb97dbd836418cb0c64",
      "bytes": 26888
    }
  ],
  "screen": {
    "status": "deferred",
    "basis": "abstract",
    "reason": "Retain JAGB spectral selection and contamination study as a calibration lead."
  },
  "extraction": null,
  "review_id": null,
  "idea_ids": []
}
