{
  "schema_version": 1,
  "paper_id": "arxiv:gr-qc/0202064v2",
  "arxiv_id": "gr-qc/0202064",
  "version": 2,
  "title": "Generalized Chaplygin Gas, Accelerated Expansion and Dark Energy-Matter Unification",
  "authors": [
    "M. C. Bento",
    "O. Bertolami",
    "A. A. Sen"
  ],
  "categories": [
    "gr-qc"
  ],
  "published_utc": "2002-02-18T10:17:00Z",
  "updated_utc": "2002-04-18T12:56:26Z",
  "urls": {
    "abstract": "https://arxiv.org/abs/gr-qc/0202064v2",
    "html": "https://arxiv.org/html/gr-qc/0202064v2",
    "pdf": "https://arxiv.org/pdf/gr-qc/0202064v2"
  },
  "license": {
    "status": "unknown",
    "redistribution": "links_and_original_notes_only",
    "reason": "Metadata supplies no verified license; retain links and original notes."
  },
  "artifacts": [
    {
      "role": "metadata",
      "url": "https://export.arxiv.org/api/query?id_list=gr-qc%2F0202064%2Castro-ph%2F0212114%2Castro-ph%2F0306004%2C1709.08933v3%2C2109.08676v2%2C2603.21675v2&max_results=6",
      "retrieved_utc": "2026-10-09T17:52:54.074504+00:00",
      "sha256": "267e50de79b1d4f09cdc5ba62ed2f40221e5a0c46b4ba15bca638b7f1b1533b5",
      "bytes": 12724
    }
  ],
  "screen": {
    "status": "deferred",
    "basis": "abstract",
    "reason": "Full-paper foundation remains unread; v2 differs from historical v1 selected-equation dossier."
  },
  "extraction": null,
  "review_id": null,
  "idea_ids": []
}
